{
  "schema_name": "emrys.run_summary",
  "schema_version": "8.0.0",
  "record_type": "run_summary",
  "run_id": "run_fixture",
  "run_contract": {
    "run_contract_sha256": "284446856367c83d6a7ff61008230d979c33238f77aae087fb87405d9c216245",
    "sample_manifest_sha256": "1111111111111111111111111111111111111111111111111111111111111111",
    "reference_contract_sha256": "2222222222222222222222222222222222222222222222222222222222222222",
    "partition_manifest_sha256": "3333333333333333333333333333333333333333333333333333333333333333",
    "primary_analysis_id": "synthetic_analysis",
    "primary_analysis_policy_sha256": "4444444444444444444444444444444444444444444444444444444444444444"
  },
  "summary_state": "incomplete",
  "generated_at": "2000-01-01T00:00:04Z",
  "inventory": {
    "path": "tests/fixtures/artifact_schema_v1/source/configs/artifact_inventory.tsv",
    "sha256": "cccccccccccccccccccccccccccccccccccccccccccccccccccccccccccccccc",
    "size_bytes": 256,
    "row_count": 1,
    "media_type": "text/tab-separated-values"
  },
  "expected_scopes": [
    {
      "scope": {
        "step_id": "09",
        "scope_type": "analysis",
        "scope_id": "synthetic_analysis"
      },
      "artifact_ids": [
        "analysis.synthetic.cmh_summary"
      ],
      "aggregate_state": "missing",
      "warnings": [
        {
          "code": "production_output_missing",
          "message": "No production Step 09 output is available.",
          "related_artifact_ids": [
            "analysis.synthetic.cmh_summary"
          ]
        }
      ],
      "errors": []
    }
  ],
  "artifacts": [
    {
      "artifact_id": "analysis.synthetic.cmh_summary",
      "scope": {
        "step_id": "09",
        "scope_type": "analysis",
        "scope_id": "synthetic_analysis"
      },
      "adapter": "step09_cmh_summary_v1",
      "expectation": {
        "required": true,
        "source_path": "tests/fixtures/artifact_schema_v1/source/results/editing/synthetic_analysis/synthetic_analysis.cmh_summary.tsv"
      },
      "availability_status": "missing",
      "completion_status": "not_attempted",
      "state_reason": "Production Step 09 output is unavailable.",
      "source": null,
      "parameters": {},
      "metrics": [],
      "warnings": [
        {
          "code": "production_output_missing",
          "message": "The expected production Step 09 artifact is missing.",
          "related_artifact_ids": [
            "analysis.synthetic.cmh_summary"
          ]
        }
      ],
      "errors": []
    }
  ],
  "computational_rollup": {
    "expected_artifact_count": 1,
    "complete_artifact_count": 0,
    "missing_artifact_count": 1,
    "incomplete_artifact_count": 0,
    "failed_artifact_count": 0,
    "externally_unavailable_artifact_count": 0
  },
  "limitations": [
    {
      "limitation_id": "production_output_missing",
      "status": "open",
      "description": "No production Step 09 output is available.",
      "impact": "The computational candidate result is unavailable.",
      "evidence_ids": []
    }
  ],
  "warnings": [
    {
      "code": "production_output_missing",
      "message": "The run summary is structurally complete but its expected Step 09 output is missing.",
      "related_artifact_ids": [
        "analysis.synthetic.cmh_summary"
      ]
    }
  ],
  "errors": [],
  "provenance": {
    "producer": "artifact_schema_fixture",
    "producer_version": "1.0.0",
    "git_commit": "fixturecommit",
    "created_at": "2000-01-01T00:00:04Z",
    "installed_package": {
      "path": "/fixtures/installed/emrys",
      "distribution": "emrys-rna-workflow",
      "version": "0.0.0+fixture",
      "content_sha256": "aaaaaaaaaaaaaaaaaaaaaaaaaaaaaaaaaaaaaaaaaaaaaaaaaaaaaaaaaaaaaaaa",
      "git_commit": null,
      "git_dirty": null,
      "python_lock_sha256": "bbbbbbbbbbbbbbbbbbbbbbbbbbbbbbbbbbbbbbbbbbbbbbbbbbbbbbbbbbbbbbbb"
    }
  },
  "analysis_policy": {
    "path": "contract/primary_analysis_policy.json",
    "sha256": "4444444444444444444444444444444444444444444444444444444444444444",
    "size_bytes": 512
  },
  "run_contract_file": {
    "path": "contract/reporting_run_contract.json",
    "sha256": "dddddddddddddddddddddddddddddddddddddddddddddddddddddddddddddddd"
  },
  "publication": {
    "attempt_id": "summary-attempt-001",
    "started_at": "2000-01-01T00:00:03Z",
    "finished_at": "2000-01-01T00:00:04Z",
    "transaction_state": "complete"
  },
  "scientific_origin": {
    "run": {
      "path": "/synthetic/original_run.json",
      "sha256": "aaaaaaaaaaaaaaaaaaaaaaaaaaaaaaaaaaaaaaaaaaaaaaaaaaaaaaaaaaaaaaaa"
    },
    "attempt": {
      "path": "/synthetic/original_attempt.json",
      "sha256": "aaaaaaaaaaaaaaaaaaaaaaaaaaaaaaaaaaaaaaaaaaaaaaaaaaaaaaaaaaaaaaaa"
    }
  },
  "tables": [
    {
      "path": "/synthetic/run_fixture/run_fixture.run_summary.tsv",
      "sha256": "aaaaaaaaaaaaaaaaaaaaaaaaaaaaaaaaaaaaaaaaaaaaaaaaaaaaaaaaaaaaaaaa",
      "size_bytes": 1
    },
    {
      "path": "/synthetic/run_fixture/run_fixture.qc_summary.tsv",
      "sha256": "aaaaaaaaaaaaaaaaaaaaaaaaaaaaaaaaaaaaaaaaaaaaaaaaaaaaaaaaaaaaaaaa",
      "size_bytes": 1
    }
  ]
}
